{
  "$schema": "https://json-schema.org/draft/2020-12/schema",
  "$id": "https://conductor.local/schemas/evidence.schema.json",
  "title": "CONDUCTOR 4.3 Operator Evidence",
  "type": "object",
  "required": ["schema_version", "evidence_id", "operator_id", "operator_name", "operator_version", "run_id", "round_id", "source_node_id", "target_group_id", "grouping_representation", "evaluation_representation", "input_features", "sample_count", "scope", "result_type", "result_values", "statistical_significance", "uncertainty", "applicability_conditions", "warnings", "supporting_compounds", "supporting_pairs", "generated_evidence", "machine_readable_summary", "human_readable_summary", "artifacts", "created_at"],
  "properties": {
    "schema_version": {"const": "2.0.0"},
    "evidence_id": {"type": "string", "pattern": "^(E[0-9]{6,}|standalone:[a-f0-9]{16})$"},
    "operator_id": {"type": "string", "pattern": "^A[0-9]{3}$"},
    "operator_name": {"type": "string", "minLength": 1},
    "operator_version": {"type": "string", "minLength": 1},
    "run_id": {"type": "string", "minLength": 1},
    "round_id": {"type": ["string", "null"], "pattern": "^RND[0-9]{4,}$"},
    "source_node_id": {"type": ["string", "null"], "pattern": "^NO[0-9]{4,}$"},
    "target_group_id": {"type": ["string", "null"]},
    "grouping_representation": {"type": ["string", "null"]},
    "evaluation_representation": {"type": ["string", "null"]},
    "input_features": {"type": "array", "items": {"type": "string"}},
    "sample_count": {"type": "integer", "minimum": 0},
    "scope": {
      "type": "object",
      "required": ["mode", "sample_count", "sample_fraction", "compound_set_hash", "reference_scope"],
      "properties": {
        "mode": {"enum": ["global", "within-group", "between-groups"]},
        "target_group_id": {"type": ["string", "null"]},
        "comparison_group_id": {"type": ["string", "null"]},
        "sample_count": {"type": "integer", "minimum": 0},
        "sample_fraction": {"type": "number", "minimum": 0, "maximum": 1},
        "compound_set_hash": {"type": "string", "pattern": "^[a-f0-9]{64}$"},
        "reference_scope": {"enum": ["global", "local"]}
      },
      "additionalProperties": true
    },
    "result_type": {"type": "string", "minLength": 1},
    "result_values": {"type": "object"},
    "statistical_significance": {"type": ["object", "null"]},
    "uncertainty": {"type": ["object", "null"]},
    "applicability_conditions": {"type": "array", "items": {"type": "string"}},
    "warnings": {"type": "array", "items": {"type": "string"}},
    "supporting_compounds": {"type": "array", "items": {"type": "string"}},
    "supporting_pairs": {"type": "array", "items": {"type": "object"}},
    "generated_evidence": {"type": "array", "items": {"type": "object"}},
    "machine_readable_summary": {"type": "object"},
    "human_readable_summary": {"type": "string"},
    "artifacts": {"type": "array", "items": {"type": "object"}},
    "created_at": {"type": "string", "format": "date-time"}
  },
  "additionalProperties": true
}
